Term,Definition,Grammatical Label,Topic,URL
air-cut mud,"A drilling fluid (or mud) that has gas (air or natural gas) bubbles in it, resulting in a lower bulk, unpressurized density compared with a mud not cut by gas. The density of gas-cut mud can be measured accurately using a pressurized mud balance. Defoamer chemicals added to the mud or a mechanical vacuum pump degasser can liberate the trapped gas. The derrickman periodically measures mud density and communicates the results to the driller via an intercom, typically reporting something like ""9.6 heavy,"" ""10.4,"" or ""13.2 light,"" indicating more than 9.6 pounds per gallon, 10.4 pounds per gallon, or less than 13.2 pounds per gallon, respectively. Each tenth of a pound per gallon is referred to as a ""point"" of mud weight. Note that for this low-accuracy measurement, no direct mention of gas cut is made. A gas cut is inferred only if the mud returning to the surface is significantly less dense than it should be. In the case of the mud logger's measurement, ""units"" of gas (having virtually no absolute meaning) are reported. For the mud logger's measurement, a direct indication of combustible gases is made, with no direct correlation to mud weight.",Noun,Drilling,https://glossary.slb.com/en/terms/a/air-cut_mud
air drilling,"A drilling technique whereby gases (typically compressed air or nitrogen) are used to cool the drill bit and lift cuttings out of the wellbore, instead of the more conventional use of liquids. The advantages of air drilling are that it is usually much faster than drilling with liquids and it may eliminate lost circulation problems. The disadvantages are the inability to control the influx of formation fluid into the wellbore and the destabilization of the borehole wall in the absence of the wellbore pressure typically provided by liquids.",Noun,Drilling,https://glossary.slb.com/en/terms/a/air_drilling
adjustable choke,"A valve usually used in well control operations to reduce the pressure of a fluid from high pressure in the closed wellbore to atmospheric pressure. It may be adjusted (opened or closed) to closely control the pressure drop. Adjustable choke valves are constructed to resist wear while high-velocity, solids-laden fluids are flowing by the restricting or sealing elements.",Noun,Drilling,https://glossary.slb.com/en/terms/a/adjustable_choke
air drill,"To drill using gases (typically compressed air or nitrogen) to cool the drill bit and lift cuttings out of the wellbore, instead of the more conventional use of liquids. The advantages of air drilling are that it is usually much faster than drilling with liquids and it may eliminate lost circulation problems. The disadvantages are the inability to control the influx of formation fluid into the wellbore and the destabilization of the borehole wall in the absence of the wellbore pressure typically provided by liquids.",Verb,Drilling,https://glossary.slb.com/en/terms/a/air_drill
abnormal pressure,"A subsurface condition in which the pore pressure of a geologic formation exceeds or is less than the expected, or normal, formation pressure. When impermeable rocks such as shales are compacted rapidly, their pore fluids cannot always escape and must then support the total overlying rock column, leading to abnormally high formation pressures. Excess pressure, called overpressure or geopressure, can cause a well to blow out or become uncontrollable during drilling. Severe underpressure can cause the drillpipe to stick to the underpressured formation.",Noun,Geology,https://glossary.slb.com/en/terms/a/abnormal_pressure
azimuth,"The angle between the vertical projection of a line of interest onto a horizontal surface and true north or magnetic north measured in a horizontal plane, typically measured clockwise from north.",Noun,Geology,https://glossary.slb.com/en/terms/a/azimuth
antiwhirl bit,"A drill bit, usually polycrystalline diamond compact bit (PDC) type, designed such that the individual cutting elements on the bit create a net imbalance force. This imbalance force pushes the bit against the side of the borehole, which in turn creates a stable rotating condition that resists backwards whirling, wobbling and downhole vibration. Antiwhirl bits allow faster rates of penetration, yet achieve longer bit life than more conventional bits, which are not dynamically biased to run smoothly, are inherently unstable, are vibration-prone and thus have shorter lives. No bit is whirl-proof, however.",Noun,Drilling,https://glossary.slb.com/en/terms/a/antiwhirl_bit
shut-in pressure,"The surface force per unit area exerted at the top of a wellbore when it is closed at either the Christmas tree or the BOP stack. The pressure may be from the formation or an external and intentional source. The SIP may be zero, indicating that any open formations are effectively balanced by the hydrostatic column of fluid in the well. If the pressure is zero, the well is considered to be dead, and can normally be opened safely to the atmosphere.",Noun,Drilling,https://glossary.slb.com/en/terms/s/shut-in_pressure
SIBP,The force per unit area exerted at the bottom of a wellbore when it is closed at either the Christmas tree or the BOP stack. The SIBP is generated by a combination of the hydrostatic pressure from the weight of the liquid in the well and any additional applied pressure. The applied pressure component may be from the formation or from an external source at the surface.,Noun,Drilling,https://glossary.slb.com/en/terms/s/sibp
SIBHP,The force per unit area exerted at the bottom of a wellbore when it is closed at either the Christmas tree or the BOP stack. The SIBP is generated by a combination of the hydrostatic pressure from the weight of the liquid in the well and any additional applied pressure. The applied pressure component may be from the formation or from an external source at the surface.,Noun,Drilling,https://glossary.slb.com/en/terms/s/sibhp
shear ram,"A blowout preventer (BOP) closing element fitted with hardened tool steel blades designed to cut the drillpipe or tubing when the BOP is closed, and then fully close to provide isolation or sealing of the wellbore. A shear ram is normally used as a last resort to regain pressure control of a well that is flowing. Once the pipe is cut (or sheared) by the shear rams, it is usually left hanging in the BOP stack, and kill operations become more difficult. The joint of drillpipe or tubing is destroyed in the process, but the rest of the string is unharmed by the operation of shear rams.",Noun,Drilling,https://glossary.slb.com/en/terms/s/shear_ram
shut-in bottomhole pressure,The force per unit area exerted at the bottom of a wellbore when it is closed at either the Christmas tree or the BOP stack. The SIBP is generated by a combination of the hydrostatic pressure from the weight of the liquid in the well and any additional applied pressure. The applied pressure component may be from the formation or from an external source at the surface.,Noun,Drilling,https://glossary.slb.com/en/terms/s/shut-in_bottomhole_pressure
sidetrack,"To drill a secondary wellbore away from an original wellbore. A sidetracking operation may be done intentionally or may occur accidentally. Intentional sidetracks might bypass an unusable section of the original wellbore or explore a geologic feature nearby. In the bypass case, the secondary wellbore is usually drilled substantially parallel to the original well, which may be inaccessible due to an irretrievable fish, junk in the hole, or a collapsed wellbore.",Verb,Drilling,https://glossary.slb.com/en/terms/s/sidetrack
show,"A surface observation of hydrocarbons, usually observed as florescent liquid on cuttings when viewed with an ultraviolet or black light (oil show) or increased gas readings from the mud logger's gas-detection equipment (gas show).",Noun,Drilling,https://glossary.slb.com/en/terms/s/show
stripping,"The act of putting drillpipe into the wellbore when the blowout preventers (BOPs) are closed and pressure is contained in the well. This is necessary when a kick is taken, since well kill operations should always be conducted with the drillstring on bottom, and not somewhere up the wellbore. If only the annular BOP has been closed, the drillpipe may be slowly and carefully lowered into the wellbore, and the BOP itself will open slightly to permit the larger diameter tool joints to pass through. If the well has been closed with the use of ram BOPs, the tool joints will not pass by the closed ram element. Hence, while keeping the well closed with either another ram or the annular BOP, the ram must be opened manually, then the pipe lowered until the tool joint is just below the ram, and then the ram closed again. This procedure is repeated whenever a tool joint must pass by a ram BOP. Rig crews are usually required to practice ram-to-ram and ram-to-annular stripping operations as part of their well control certifications. In stripping operations, the combination of the pressure in the well and the weight of the drillstring is such that the pipe falls in the hole under its own weight, whereas in snubbing operations the pipe must be pushed into the hole.",Noun,Drilling,https://glossary.slb.com/en/terms/s/stripping
sub,"Any small component of the drillstring, such as a short drill collar or a thread crossover.",Noun,Drilling,https://glossary.slb.com/en/terms/s/sub
stuck pipe,The portion of the drillstring that cannot be rotated or moved vertically.,Noun,Drilling,https://glossary.slb.com/en/terms/s/stuck_pipe
stuck,"Referring to the varying degrees of inability to move or remove the drillstring from the wellbore. At one extreme, it might be possible to rotate the pipe or lower it back into the wellbore, or it might refer to an inability to move the drillstring vertically in the well, though rotation might be possible. At the other extreme, it reflects the inability to move the drillstring in any manner. Usually, even if the stuck condition starts with the possibility of limited pipe rotation or vertical movement, it will degrade to the inability to move the pipe at all.",Adjective,Drilling,https://glossary.slb.com/en/terms/s/stuck
structural steering,"Structural steering is a method of directing the wellbore trajectory of horizontal wells using 3D visualization. It is the process of combining structural analysis and modeling capabilities with borehole images to optimize well placement, often in real-time. Structural steering integrates deep-reading LWD resistivity tools and high-resolution imaging devices to create structural models of often complex geologic conditions encountered by the drill bit. This technique helps operators understand the formations already drilled and allows them proactively to correct wellbore trajectories for anticipated changes.",Noun,Drilling,https://glossary.slb.com/en/terms/s/structural_steering
submersible drilling rig,"A particular type of floating vessel, usually used as a mobile offshore drilling unit (MODU), that is supported primarily on large pontoon-like structures submerged below the seasurface. The operating decks are elevated 100 or more feet [30 m] above the pontoons on large steel columns. Once on the desired location, this type of structure is slowly flooded until it rests on the seafloor. After the well is completed, the water is pumped out of the buoyancy tanks, the vessel refloated and towed to the next location. Submersibles, as they are known informally, operate in relatively shallow water, since they must actually rest on the seafloor.",Noun,Drilling,https://glossary.slb.com/en/terms/s/submersible_drilling_rig
steerable motor,"A mud motor incorporating a bent housing that may be stabilized like a rotary bottomhole assembly. A steerable motor can be used to steer the wellbore without drillstring rotation in directional drilling operations, or to drill ahead in a rotary drilling mode.",Noun,Drilling,https://glossary.slb.com/en/terms/s/steerable_motor
swellable packer,"An isolation device that relies on elastomers to expand and form an annular seal when immersed in certain wellbore fluids. The elastomers used in these packers are either oil- or water-sensitive. Their expansion rates and pressure ratings are affected by a variety of factors. Oil-activated elastomers, which work on the principle of absorption and dissolution, are affected by fluid temperature as well as the concentration and specific gravity of hydrocarbons in a fluid. Water-activated elastomers are typically affected by water temperature and salinity. This type of elastomer works on the principle of osmosis, which allows movement of water particles across a semi-permeable membrane based on salinity differences in the water on either side of the membrane.",Noun,Drilling,https://glossary.slb.com/en/terms/s/swellable_packer
swivel,A mechanical device that suspends the weight of the drillstring. It is designed to allow rotation of the drillstring beneath it conveying high volumes of high-pressure drilling mud between the rig's circulation system and the drillstring.,Noun,Drilling,https://glossary.slb.com/en/terms/s/swivel
swab,"To reduce pressure in a wellbore by moving pipe, wireline tools or rubber-cupped seals up the wellbore. If the pressure is reduced sufficiently, reservoir fluids may flow into the wellbore and towards the surface. Swabbing is generally considered harmful in drilling operations, because it can lead to kicks and wellbore stability problems. In production operations, however, the term is used to describe how the flow of reservoir hydrocarbons is initiated in some completed wells.",Verb,Drilling,https://glossary.slb.com/en/terms/s/swab
swivel flange,"A flange consisting of two parts—a hub and a ring. The hub contains the gasket profile, and the ring features the bolt-hole pattern. The ring can rotate around the hub for easier makeup. Once the bolts are tightened, the ring is compressed against the hub via a shoulder and secured in place.",Noun,Drilling,https://glossary.slb.com/en/terms/s/swivel_flange
suction pit,"A mud tank, usually made of steel, connected to the intake of the main rig pumping system. The connection is commonly formed with a centrifugal pump charging the main rig pumps to increase efficiency. Since it is the last tank in the surface mud system, the suction pit should contain the cleanest and best-conditioned mud on location. It is also the most representative of mud characteristics in the hole, except for temperature.",Noun,Drilling,https://glossary.slb.com/en/terms/s/suction_pit
surface pipe,"Another term for surface casing, a large-diameter, relatively low-pressure pipe string set in shallow yet competent formations for several reasons. First, the surface casing protects fresh-water aquifers onshore. Second, the surface casing provides minimal pressure integrity, and thus enables a diverter or perhaps even a blowout preventer (BOP) to be attached to the top of the surface casing string after it is successfully cemented in place. Third, the surface casing provides structural strength so that the remaining casing strings may be suspended at the top and inside of the surface casing.",Noun,Drilling,https://glossary.slb.com/en/terms/s/surface_pipe
survey,"A dataset measured and recorded with reference to a particular area of the Earth's surface, such as a seismic survey.",Noun,Geophysics,https://glossary.slb.com/en/terms/s/survey
supply vessel,"In offshore operations, any barge, boat or ship that brings materials and personnel to and from the rigsite.",Noun,Drilling,https://glossary.slb.com/en/terms/s/supply_vessel
surface casing,"A large-diameter, relatively low-pressure pipe string set in shallow yet competent formations for several reasons. First, the surface casing protects fresh-water aquifers onshore. Second, the surface casing provides minimal pressure integrity, and thus enables a diverter or perhaps even a blowout preventer (BOP) to be attached to the top of the surface casing string after it is successfully cemented in place. Third, the surface casing provides structural strength so that the remaining casing strings may be suspended at the top and inside of the surface casing.",Noun,Drilling,https://glossary.slb.com/en/terms/s/surface_casing
spacer fluid,"Any liquid used to physically separate one special-purpose liquid from another. Special-purpose liquids are typically prone to contamination, so a spacer fluid compatible with each is used between the two. The most common spacer is simply water. However, chemicals are usually added to enhance its performance for the particular operation. Spacers are used primarily when changing mud types and to separate mud from cement during cementing operations. In the former, an oil-base fluid must be kept separate from a water-base fluid. In this case, the spacer may be base oil. In the latter operation, a chemically treated water spacer usually separates drilling mud from cement slurry. For proper performance and to prevent unanticipated problems, the spacer should be tested with each fluid in small-scale pilot tests. Some spacer fluids are designed to induce a particular flow regime. Ideally, a cement slurry should have turbulent flow to efficiently displace drilling fluids, but there might be pumping restrictions on fluid velocity. Therefore, a spacer that can achieve turbulent or pseudolaminar flow might be selected.",Noun,Drilling,https://glossary.slb.com/en/terms/s/spacer_fluid
sheave,"A pulley. In oilfield usage, the term usually refers to either the pulleys permanently mounted on the top of the rig (the crown blocks), or the pulleys used for running wireline tools into the wellbore. In the case of the crown blocks, the drilling line, a heavy wire rope, is threaded between the crown blocks and the traveling blocks in a block and tackle arrangement to gain mechanical advantage. A relatively weak drilling line, with a breaking strength of perhaps 100,000 pounds [45,400 kg], may be used to lift much larger loads, perhaps in excess of one million pounds [454,000 kg]. During wireline operations, two sheaves are temporarily hung in the derrick, and the wireline is run from the logging truck through the sheaves and then down to the logging tool in the wellbore.",Noun,Drilling,https://glossary.slb.com/en/terms/s/sheave
shoe,"The bottom of the casing string, including the cement around it, or the equipment run at the bottom of the casing string.",Noun,Drilling,https://glossary.slb.com/en/terms/s/shoe
slips,"A device used to grip the drillstring in a relatively nondamaging manner and suspend it in the rotary table. This device consists of three or more steel wedges that are hinged together, forming a near circle around the drillpipe. On the drillpipe side (inside surface), the slips are fitted with replaceable, hardened tool steel teeth that embed slightly into the side of the pipe. The outsides of the slips are tapered to match the taper of the rotary table. After the rig crew places the slips around the drillpipe and in the rotary, the driller slowly lowers the drillstring. As the teeth on the inside of the slips grip the pipe, the slips are pulled down. This downward force pulls the outer wedges down, providing a compressive force inward on the drillpipe and effectively locking everything together. Then the rig crew can unscrew the upper portion of the drillstring (kelly, saver sub, a joint or stand of pipe) while the lower part is suspended. After some other component is screwed onto the lower part of the drillstring, the driller raises the drillstring to unlock the gripping action of the slips, and the rig crew removes the slips from the rotary.",Noun,Drilling,https://glossary.slb.com/en/terms/s/slips
slip joint,"A telescoping joint at the surface in floating offshore operations that permits vessel heave (vertical motion) while maintaining a riser pipe to the seafloor. As the vessel heaves, the slip joint telescopes in or out by the same amount so that the riser below the slip joint is relatively unaffected by vessel motion.",Noun,Drilling,https://glossary.slb.com/en/terms/s/slip_joint
slimhole well,"An inexact term describing a borehole (and associated casing program) significantly smaller than a standard approach, commonly a wellbore less than 6 in. in diameter. The slimhole concept has its roots in the observed correlation between well costs and volume of rock extracted. If one can extract less rock, then well costs should fall. One form of slimhole work involves using more or less conventional equipment and procedures, but simply reducing the hole and casing sizes for each hole interval. A second form involves technology used for exploration boreholes in the hard rock mining industry. In the mining rig operations, the drillstem serves a dual purpose. After the hole is drilled, the drillstem remains in the hole and is cemented in place. Then a new drillstem is used for the new hole section, and also cemented in place. The drillstring for mining rig operations is rotated like that for conventional oilfield rotary rig operations, but typically at a much higher speed.",Noun,Drilling,https://glossary.slb.com/en/terms/s/slimhole_well
slip and cut,"To replace the drilling line wrapped around the crown block and traveling block. As a precaution against drilling line failure due to fatigue, the work done by the drilling line is closely monitored and limited. The work is commonly measured as the cumulative product of the load lifted (in tons) and the distance lifted or lowered (in miles). After a predetermined limit of ton-miles, new line is unspooled from the storage reel and slipped through the crown block and traveling block sheaves and drawworks spool, with the excess on the drawworks spool end cut off and discarded.",Verb,Drilling,https://glossary.slb.com/en/terms/s/slip_and_cut
short trip,"An abbreviated recovery of pipe out of, and then the replacement of same back into the wellbore. Such a trip is normally limited to 10 or 20 stands of drillpipe. Since the short trip is drillpipe only (no bottomhole assembly for the drilling crew to handle), and is limited in length, it can be accomplished quickly and sometimes results in additional information or improved operating conditions. A short trip often is used to gauge whether a hole is clean or whether the mud weight is sufficient to permit a full trip out of the hole.",Noun,Drilling,https://glossary.slb.com/en/terms/s/short_trip
shale shaker,"The primary and probably most important device on the rig for removing drilled solids from the mud. This vibrating sieve is simple in concept, but a bit more complicated to use efficiently. A wire-cloth screen vibrates while the drilling fluid flows on top of it. The liquid phase of the mud and solids smaller than the wire mesh pass through the screen, while larger solids are retained on the screen and eventually fall off the back of the device and are discarded. Obviously, smaller openings in the screen clean more solids from the whole mud, but there is a corresponding decrease in flow rate per unit area of wire cloth. Hence, the drilling crew should seek to run the screens (as the wire cloth is called), as fine as possible, without dumping whole mud off the back of the shaker. Where it was once common for drilling rigs to have only one or two shale shakers, modern high-efficiency rigs are often fitted with four or more shakers, thus giving more area of wire cloth to use, and giving the crew the flexibility to run increasingly fine screens.",Noun,Drilling,https://glossary.slb.com/en/terms/s/shale_shaker
shoe joint,"Another term for float joint, a full-sized length of casing placed at the bottom of the casing string that is usually left full of cement on the inside to ensure that good cement remains on the outside of the bottom of the casing. If cement were not left inside the casing in this manner, the risk of overdisplacing the cement (due to improper casing volume calculations, displacement mud volume measurements, or both) would be significantly higher. Hence, the well designer plans on a safety margin of cement left inside the casing to guarantee that the fluid left outside the casing is good-quality cement. A float collar is placed at the top of the float joint and a float shoe placed at the bottom to prevent reverse flow of cement back into the casing after placement. There can be one, two or three joints of casing used for this purpose.",Noun,Drilling,https://glossary.slb.com/en/terms/s/shoe_joint
shoe track,"Another term for float joint, a full-sized length of casing placed at the bottom of the casing string that is usually left full of cement on the inside to ensure that good cement remains on the outside of the bottom of the casing. If cement were not left inside the casing in this manner, the risk of overdisplacing the cement (due to improper casing volume calculations, displacement mud volume measurements, or both) would be significantly higher. Hence, the well designer plans on a safety margin of cement left inside the casing to guarantee that the fluid left outside the casing is good-quality cement. A float collar is placed at the top of the float joint and a float shoe placed at the bottom to prevent reverse flow of cement back into the casing after placement. There can be one, two or three joints of casing used for this purpose.",Noun,Drilling,https://glossary.slb.com/en/terms/s/shoe_track
