Term,Definition,Grammatical Label,Topic,URL

BHA,"The lower portion of the drillstring, consisting of (from the bottom up in a vertical well) the bit, bit sub, a mud motor (in certain cases), stabilizers, drill collar, heavy-weight drillpipe, jarring devices (""jars""), and crossovers for various threadforms. The bottomhole assembly must provide force for the bit to break the rock (weight on bit), survive a hostile mechanical environment, and provide the driller with directional control of the well. Oftentimes the assembly includes a mud motor, directional drilling and measuring equipment, measurements-while-drilling tools, logging-while-drilling tools, and other specialized devices.",Noun,Drilling,https://glossary.slb.com/en/terms/b/bha
BOP,"A large valve at the top of a well that may be closed if the drilling crew loses control of formation fluids. By closing this valve (usually operated remotely via hydraulic actuators), the drilling crew usually regains control of the reservoir, and procedures can then be initiated to increase the mud density until it is possible to open the BOP and retain pressure control of the formation.",Noun,Drilling,https://glossary.slb.com/en/terms/b/bop
packer,"A device that can be run into a wellbore with a smaller initial outside diameter that then expands externally to seal the wellbore. Packers employ flexible, elastomeric elements that expand. The two most common forms are the production or test packer and the inflatable packer. The expansion of the former may be accomplished by squeezing the elastomeric elements (somewhat doughnut shaped) between two plates, forcing the sides to bulge outward. The expansion of the latter is accomplished by pumping a fluid into a bladder, in much the same fashion as a balloon, but having more robust construction. Production or test packers may be set in cased holes and inflatable packers are used in open or cased holes. They may be run on wireline, pipe or coiled tubing. Some packers are designed to be removable, while others are permanent. Permanent packers are constructed of materials that are easy to drill or mill out.",Noun,Drilling,https://glossary.slb.com/en/terms/p/packer
Christmas tree,"The set of valves, spools, and fittings connected to the top of a well to direct and control the flow of formation fluids from the well.",Noun,Drilling,https://glossary.slb.com/en/terms/c/christmas_tree
extended-reach drilling,Mobil Oil Company first used this term in the early 1980s for drilling directional wells in which the drilled horizontal reach (HR) attained at total depth (TD) exceeded the true vertical depth (TVD) by a factor greater than or equal to two. Extended-reach drilling (ERD) is particularly challenging for directional drilling and requires specialized planning to execute well construction.,Noun,Drilling,https://glossary.slb.com/en/terms/e/extended-reach_drilling
extended reach drilling,Mobil Oil Company first used this term in the early 1980s for drilling directional wells in which the drilled horizontal reach (HR) attained at total depth (TD) exceeded the true vertical depth (TVD) by a factor greater than or equal to two. Extended-reach drilling (ERD) is particularly challenging for directional drilling and requires specialized planning to execute well construction.,Noun,Drilling,https://glossary.slb.com/en/terms/e/extended_reach_drilling
exit velocity,"The speed the drilling fluid attains when accelerated through bit nozzles. The exit velocity is typically in the low-hundreds of feet per second. It has been reported that in certain shaly formations, an impingement velocity on the order of 250 feet per second is required to effectively remove newly created rock chips from the bottom of the hole. This impingement velocity is not, however, the same as the exit velocity, since the high-energy fluid jet loses velocity through viscous losses and conversions from kinetic energy to forms of potential energy occur once the fluid leaves the bit. For this reason, the well designer generally seeks to maximize the fluid velocity (or other measure of jet energy) to achieve maximum cleaning at the bottom of the hole.",Noun,Drilling,https://glossary.slb.com/en/terms/e/exit_velocity
endless tubing,"Another term for coiled tubing, a long, continuous length of pipe wound on a spool. The pipe is straightened prior to pushing into a wellbore and rewound to coil the pipe back onto the transport and storage spool. Depending on the pipe diameter (1 in. to 4 1/2 in.) and the spool size, coiled tubing can range from 2,000 ft to 15,000 ft [610 to 4,570 m] or greater length.",Noun,Drilling,https://glossary.slb.com/en/terms/e/endless_tubing
ERD,Abbreviation for extended-reach drilling. Mobil Oil Company first used this term in the early 1980s for drilling directional wells in which the drilled horizontal reach (HR) attained at total depth (TD) exceeded the true vertical depth (TVD) by a factor greater than or equal to two. Extended-reach drilling (ERD) is particularly challenging for directional drilling and requires specialized planning to execute well construction.,Noun,Drilling,https://glossary.slb.com/en/terms/e/erd
escape line,"A steel cable attached to the rig derrick or mast near the work platform for the derrickman. This cable is anchored at surface level (on a vessel or the Earth) away from the mast in a loose catenary profile, and fitted with a handle and hand brake that is stored at the top. The escape line provides a rapid escape path for the derrickman should well conditions or massive mechanical failure warrant. In such a case the derrickman would disconnect his safety belt from the rig, rehook it over the escape line if time permitted, firmly grip the tee-bar handle and ride the trolley down the cable while holding on to the handle with his hands. The escape line is also known as the ""Geronimo line.""",Noun,Drilling,https://glossary.slb.com/en/terms/e/escape_line
erode,"To cause or undergo erosion, the process of denudation of rocks, including physical, chemical and biological breakdown and transportation. The material from the rocks can be transported by wind, water, ice, or abrasive solid particles, or by mass-wasting, as in rock falls and landslides.",Verb,Geology,https://glossary.slb.com/en/terms/e/erode
erosion,"The process of denudation of rocks, including physical, chemical and biological breakdown and transportation.",Noun,Geology,https://glossary.slb.com/en/terms/e/erosion
eccentricity,"The term used to describe how off-center a pipe is within another pipe or the openhole. It is usually expressed as a percentage. A pipe would be considered to be fully (100%) eccentric if it were lying against the inside diameter of the enclosing pipe or hole. A pipe would be said to be concentric (0% eccentric) if it were perfectly centered in the outer pipe or hole. Eccentricity becomes important to the well designer in estimating casing wear, wear and tear on the drillstring, and the removal of cuttings from the low side of an inclined hole. In the latter case, if the drillpipe lies on the low side of the hole (100% eccentric), the eccentricity results in low-velocity fluid flow on the low side. Gravity pulls cuttings to the low side of the hole, building a bed of small rock chips on the low side of the hole known as a cuttings bed. This cuttings bed becomes difficult to clean out of the annulus and can lead to significant problems for the drilling operation if the pipe becomes stuck in the cuttings bed.",Noun,Drilling,https://glossary.slb.com/en/terms/e/eccentricity
electrodynamic brake,"An electric motor that acts as a brake. Braking is accomplished by reversing the electric fields on the motor, effectively turning it into a generator. The usage of the generated power, either in useful applications or dissipation as heat, restrains the motor-turned-generator and provides a braking action.",Noun,Drilling,https://glossary.slb.com/en/terms/e/electrodynamic_brake
eccentric,"Off-center, as when a pipe is off-center within another pipe or the openhole. Eccentricity is usually expressed as a percentage. A pipe would be considered to be fully (100%) eccentric if it were lying against the inside diameter of the enclosing pipe or hole. A pipe would be said to be concentric (0% eccentric) if it were perfectly centered in the outer pipe or hole. Eccentricity becomes important to the well designer in estimating casing wear, wear and tear on the drillstring, and the removal of cuttings from the low side of an inclined hole. In the latter case, if the drillpipe lies on the low side of the hole (100% eccentric), the eccentricity results in low-velocity fluid flow on the low side. Gravity pulls cuttings to the low side of the hole, building a bed of small rock chips on the low side of the hole known as a cuttings bed. This cuttings bed becomes difficult to clean out of the annulus and can lead to significant problems for the drilling operation if the pipe becomes stuck in the cuttings bed.",Adjective,Drilling,https://glossary.slb.com/en/terms/e/eccentric
fishing tool,"A general term for special mechanical devices used to aid the recovery of equipment lost downhole. These devices generally fall into four classes: diagnostic, inside grappling, outside grappling, and force intensifiers or jars. Diagnostic devices may range from a simple impression block made in a soft metal, usually lead, that is dropped rapidly onto the top of the fish so that upon inspection at the surface, the fisherman may be able to custom design a tool to facilitate attachment to and removal of the fish. Other diagnostic tools may include electronic instruments and even downhole sonic or visual-bandwidth cameras. Inside grappling devices, usually called spears, generally have a tapered and threaded profile, enabling the fisherman to first guide the tool into the top of the fish, and then thread the fishing tool into the top of the fish so that recovery may be attempted. Outside grappling devices, usually called overshots, are fitted with threads or another shape that ""swallows"" the fish and does not release it as it is pulled out of the hole. Overshots are also fitted with a crude drilling surface at the bottom, so that the overshot may be lightly drilled over the fish, sometimes to remove rock or metallic junk that may be part of the sticking mechanism. Jars are mechanical downhole hammers, which enable the fisherman to deliver high-impact loads to the fish, far in excess of what could be applied in a quasi-static pull from the surface.",Noun,Drilling,https://glossary.slb.com/en/terms/f/fishing_tool
fish,"Anything left in a wellbore. It does not matter whether the fish consists of junk metal, a hand tool, a length of drillpipe or drill collars, or an expensive MWD and directional drilling package. Once the component is lost, it is properly referred to as simply ""the fish."" Typically, anything put into the hole is accurately measured and sketched, so that appropriate fishing tools can be selected if the item must be fished out of the hole.",Noun,Drilling,https://glossary.slb.com/en/terms/f/fish
fixed-cutter bit,"A drilling tool that uses polycrystalline diamond compact (PDC) cutters to shear rock with a continuous scraping motion. These cutters are synthetic diamond disks about 1/8-in thick and about 1/2 to 1 in in diameter. PDC bits are effective at drilling shale formations, especially when used in combination with oil-base muds.",Noun,Drilling,https://glossary.slb.com/en/terms/f/fixed-cutter_bit
fingerboard,"The working platform approximately halfway up the derrick or mast in which the derrickman stores drillpipe and drill collars in an orderly fashion during trips out of the hole. The entire platform consists of a small section from which the derrickman works (called the monkeyboard), and several steel fingers with slots between them that keep the tops of the drillpipe in place.",Noun,Drilling,https://glossary.slb.com/en/terms/f/fingerboard
flowline,"The large-diameter metal pipe that connects the bell nipple under the rotary table to the possum belly at the mud tanks. The flowline is simply an inclined, gravity-flow conduit to direct mud coming out the top of the wellbore to the mud surface-treating equipment. When drilling certain highly reactive clays, called ""gumbo,"" the flowline may become plugged and require considerable effort by the rig crew to keep it open and flowing. In addition, the flowline is usually fitted with a crude paddle-type flow-measuring device commonly called a ""flow show"" that may give the driller the first indication that the well is flowing.",Noun,Drilling,https://glossary.slb.com/en/terms/f/flowline
flapper valve,"A check valve that has a spring-loaded plate (or flapper) that may be pumped through, generally in the downhole direction, but closes if the fluid attempts to flow back through the drillstring to the surface. This reverse flow might be encountered either due to a U-tube effect when the bulk density of the mud in the annulus is higher than that inside the drillpipe, or a well control event.",Noun,Drilling,https://glossary.slb.com/en/terms/f/flapper_valve
float joint,"A full-sized length of casing placed at the bottom of the casing string that is usually left full of cement on the inside to ensure that good cement remains on the outside of the bottom of the casing. If cement were not left inside the casing in this manner, the risk of overdisplacing the cement (due to improper casing volume calculations, displacement mud volume measurements, or both) would be significantly higher. Hence, the well designer plans on a safety margin of cement left inside the casing to guarantee that the fluid left outside the casing is good-quality cement. A float collar is placed at the top of the float joint and a float shoe placed at the bottom to prevent reverse flow of cement back into the casing after placement. There can be one, two or three joints of casing used for this purpose.",Noun,Drilling,https://glossary.slb.com/en/terms/f/float_joint
free water,"Water that is mobile, available to flow, and not bound to surfaces of grains or minerals in rock.",Noun,Geology,https://glossary.slb.com/en/terms/f/free_water
formation pressure,"The pressure of fluids within the pores of a reservoir, usually hydrostatic pressure, or the pressure exerted by a column of water from the formation's depth to sea level. When impermeable rocks such as shales form as sediments are compacted, their pore fluids cannot always escape and must then support the total overlying rock column, leading to anomalously high formation pressures. Because reservoir pressure changes as fluids are produced from a reservoir, the pressure should be described as measured at a specific time, such as initial reservoir pressure.",Noun,Geology,https://glossary.slb.com/en/terms/f/formation_pressure
flow line,"The large-diameter metal pipe that connects the bell nipple under the rotary table to the possum belly at the mud tanks. The flowline is simply an inclined, gravity-flow conduit to direct mud coming out the top of the wellbore to the mud surface-treating equipment. When drilling certain highly reactive clays, called ""gumbo,"" the flowline may become plugged and require considerable effort by the rig crew to keep it open and flowing. In addition, the flowline is usually fitted with a crude paddle-type flow-measuring device commonly called a ""flow show"" that may give the driller the first indication that the well is flowing.",Noun,Drilling,https://glossary.slb.com/en/terms/f/flow_line
formation damage,"Alteration of the far-field or virgin characteristics of a producing formation, usually by exposure to drilling fluids. The water or solid particles in the drilling fluids, or both, tend to decrease the pore volume and effective permeability of the producible formation in the near-wellbore region. At least two mechanisms are at work. First, solid particles from the drilling fluid physically plug or bridge across flowpaths in the porous formation. Second, when water contacts certain clay minerals in the formation, the clay typically swells, increasing in volume and decreasing the pore volume. Third, chemical reactions between the drilling fluid and the formation rock and fluids can precipitate solids or semisolids that plug pore spaces. One approach to minimize formation damage is to use drill-in or completion fluids that are specially formulated to avoid damage to the formation when drilling pay zones, rather than ordinary drilling fluids.",Noun,Drilling,https://glossary.slb.com/en/terms/f/formation_damage
formation evaluation while drilling,"Also known as logging while drilling or LWD, the measurement of formation properties during the excavation of the hole, or shortly thereafter, through the use of tools integrated into the bottomhole assembly. LWD, while sometimes risky and expensive, has the advantage of measuring properties of a formation before drilling fluids invade deeply. Further, many wellbores prove to be difficult or even impossible to measure with conventional wireline tools, especially highly deviated wells. In these situations, the LWD measurement ensures that some measurement of the subsurface is captured in the event that wireline operations are not possible. Timely LWD data can also be used to guide well placement so that the wellbore remains within the zone of interest or in the most productive portion of a reservoir, such as in highly variable shale reservoirs.",Noun,Drilling,https://glossary.slb.com/en/terms/f/formation_evaluation_while_drilling
fluid caliper,"A wellbore survey in which the annular volume of a hole is mathematically calculated with a flowmeter and a marker. The drilling fluid in the hole is used as an analog to determine the amount of cement needed to circulate back to surface. It does not affect drilling fluid density or weight and can be surveyed while drilling. A fluid caliper can be run on any string to any depth. It can be run with circulation loss, but not with entirely lost returns.",Noun,Drilling,https://glossary.slb.com/en/terms/f/fluid_caliper
gas show,"Gas that rises to the surface, usually detected because it reduces the density of the drilling mud. Gas detectors, which the mud logger monitors, measure combustible gases (methane, ethane, butane and others). The mud logger reports total gas, individual gas components, or both, on the mud log. In extreme cases, gas visibly bubbles out of the mud as it returns to the surface. Because the mud does not circulate to the surface for a considerable time, sometimes lagging several hours after a formation is drilled, a gas show may be representative of what happened in the wellbore hours (or many feet) prior to the current total depth of the well.",Noun,Drilling,https://glossary.slb.com/en/terms/g/gas_show
gauge hole,"A wellbore that is essentially the same diameter as the bit that was used to drill it. It is common to find well-consolidated sandstones and carbonate rocks that remain gauge after being drilled. For clays, it is common for the hole to slowly enlarge with the passing of time, especially if water-base muds are being used. Bit gauges, rings of defined circumference, are slipped around drill bits to detect and measure wear, which reduces the circumference of the bit during drilling.",Noun,Drilling,https://glossary.slb.com/en/terms/g/gauge_hole
gumbo,"A generic term for soft, sticky, swelling clay formations that are frequently encountered in surface holes offshore or in sedimentary basins onshore near seas. This clay fouls drilling tools and plugs piping, both severe problems for drilling crews.",Noun,Drilling,https://glossary.slb.com/en/terms/g/gumbo
guide shoe,"A tapered, often bullet-nosed piece of equipment often found on the bottom of a casing string. The device guides the casing toward the center of the hole and minimizes problems associated with hitting rock ledges or washouts in the wellbore as the casing is lowered into the well. The outer portions of the guide shoe are made from steel, generally matching the casing in size and threads, if not steel grade. The inside (including the taper) is generally made of cement or thermoplastic, since this material must be drilled out if the well is to be deepened beyond the casing point. It differs from a float shoe in that it lacks a check valve.",Noun,Drilling,https://glossary.slb.com/en/terms/g/guide_shoe
geosteer,"To control the direction of a well based on the results of downhole geological logging measurements rather than three-dimensional targets in space, usually to keep a directional wellbore within a pay zone. In mature areas, geosteering may be used to keep a wellbore in a particular section of a reservoir to minimize gas or water breakthrough and maximize economic production from the well.",Verb,Drilling,https://glossary.slb.com/en/terms/g/geosteer
Geronimo line,"A steel cable attached to the rig derrick or mast near the work platform for the derrickman. This cable is anchored at surface level (on a vessel or the Earth) away from the mast in a loose catenary profile, and fitted with a handle and hand brake that is stored at the top. The escape line provides a rapid escape path for the derrickman should well conditions or massive mechanical failure warrant. In such a case the derrickman would disconnect his safety belt from the rig, rehook it over the escape line if time permitted, firmly grip the tee-bar handle and ride the trolley down the cable while holding on to the handle with his hands. The escape line is also known as the ""Geronimo line.""",Noun,Drilling,https://glossary.slb.com/en/terms/g/geronimo_line
graveyard tour,"The overnight work shift of a drilling crew. Drilling operations usually occur around the clock because of the cost to rent a rig. As a result, there are usually two separate crews working twelve-hour tours to keep the operation going. Some companies prefer three eight-hour tours. The graveyard tour is the shift that begins at midnight. (Pronounced ""tower"" in many areas.)",Noun,Drilling,https://glossary.slb.com/en/terms/g/graveyard_tour
gas-cut mud,"A drilling fluid (or mud) that has gas (air or natural gas) bubbles in it, resulting in a lower bulk, unpressurized density compared with a mud not cut by gas. The density of gas-cut mud can be measured accurately using a pressurized mud balance. Defoamer chemicals added to the mud or a mechanical vacuum pump degasser can liberate the trapped gas. The derrickman periodically measures mud density and communicates the results to the drilling crew via an intercom, typically reporting something like ""9.6 heavy,"" ""10.4,"" or ""13.2 light,"" indicating more than 9.6 pounds per gallon, 10.4 pounds per gallon, or less than 13.2 pounds per gallon, respectively. Each tenth of a pound per gallon is referred to as a ""point"" of mud weight. Note that for this low-accuracy measurement, no direct mention of gas cut is made. A gas cut is inferred only if the mud returning to the surface is significantly less dense than it should be. In the case of the mud logger's measurement, ""units"" of gas (having virtually no absolute meaning) are reported. For the mud logger's measurement, a direct indication of combustible gases is made, with no direct correlation to mud weight.",Noun,Drilling,https://glossary.slb.com/en/terms/g/gas-cut_mud
gamma ray log,A common and inexpensive measurement of the natural emission of gamma rays by a formation. Gamma ray logs are particularly helpful because shales and sandstones typically have different gamma ray signatures that can be correlated readily between wells.,Noun,Drilling,https://glossary.slb.com/en/terms/g/gamma_ray_log
gravity toolface,"Toolface angle used for deviated wells. Gravity toolface is the angle of the borehole survey instrument within the wellbore measured clockwise relative to up and in the plane perpendicular to the wellbore axis; the high side (maximum build), maximum right, low side (maximum drop) and maximum left directions have gravity toolface angles of 0°, 90°, 180° and 270°, respectively.",Noun,Drilling,https://glossary.slb.com/en/terms/g/gravity_toolface
geosteering,"The intentional directional control of a well based on the results of downhole geological logging measurements rather than three-dimensional targets in space, usually to keep a directional wellbore within a pay zone. In mature areas, geosteering may be used to keep a wellbore in a particular section of a reservoir to minimize gas or water breakthrough and maximize economic production from the well.",Noun,Drilling,https://glossary.slb.com/en/terms/g/geosteering
goose neck,"An inverted ""U"" shaped section of rigid piping normally used as a conduit for high-pressure drilling fluid. In particular, the term is applied to a structure that connects the top of a vertical standpipe running up the side of a derrick or mast to a flexible kelly hose that in turn is connected to another gooseneck between the flexible line and the swivel.",Noun,Drilling,https://glossary.slb.com/en/terms/g/goose_neck
high-side toolface,"Toolface angle used for deviated wells. High-side toolface is the angle of the borehole survey instrument within the wellbore measured clockwise relative to up and in the plane perpendicular to the wellbore axis; the high side (maximum build), maximum right, low side (maximum drop) and maximum left directions have high-side toolface angles of 0°, 90°, 180° and 270°, respectively.",Noun,Drilling,https://glossary.slb.com/en/terms/h/high-side_toolface
