Term,Definition,Grammatical Label,Topic,URL
roller cone bit,"A tool designed to crush rock efficiently while incurring a minimal amount of wear on the cutting surfaces. Invented by Howard Hughes, the roller-cone bit has conical cutters or cones that have spiked teeth around them. As the drillstring is rotated, the bit cones roll along the bottom of the hole in a circle. As they roll, new teeth come in contact with the bottom of the hole, crushing the rock immediately below and around the bit tooth. As the cone rolls, the tooth then lifts off the bottom of the hole and a high-velocity fluid jet strikes the crushed rock chips to remove them from the bottom of the hole and up the annulus. As this occurs, another tooth makes contact with the bottom of the hole and creates new rock chips. Thus, the process of chipping the rock and removing the small rock chips with the fluid jets is continuous. The teeth intermesh on the cones, which helps clean the cones and enables larger teeth to be used. There are two main types of roller-cone bits, steel milled-tooth bits and carbide insert bits.",Noun,Drilling,https://glossary.slb.com/en/terms/r/roller_cone_bit
roustabout,"Any unskilled manual laborer on the rigsite. A roustabout may be part of the drilling contractor's employee workforce, or may be on location temporarily for special operations. Roustabouts are commonly hired to ensure that the skilled personnel that run an expensive drilling rig are not distracted by peripheral tasks, ranging from cleaning up location to cleaning threads to digging trenches to scraping and painting rig components. Although roustabouts typically work long hard days, this type of work can lead to more steady employment on a rig crew.",Noun,Drilling,https://glossary.slb.com/en/terms/r/roustabout
ram blowout preventer,"A device that can be used to quickly seal the top of the well in the event of a well control event (kick). A ram blowout preventer (BOP) consists of two halves of a cover for the well that are split down the middle. Large-diameter hydraulic cylinders, normally retracted, force the two halves of the cover together in the middle to seal the wellbore. These covers are constructed of steel for strength and fitted with elastomer components on the sealing surfaces. The halves of the covers, formally called ram blocks, are available in a variety of configurations. In some designs, they are flat at the mating surfaces to enable them to seal over an open wellbore. Other designs have a circular cutout in the middle that corresponds to the diameter of the pipe in the hole to seal the well when pipe is in the hole. These pipe rams effectively seal a limited range of pipe diameters. Variable-bore rams are designed to seal a wider range of pipe diameters, albeit at a sacrifice of other design criteria, notably element life and hang-off weight. Still other ram blocks are fitted with a tool steel-cutting surface to enable the ram BOPs to completely shear through drillpipe, hang the drillstring off on the ram blocks themselves and seal the wellbore. Obviously, such an action limits future options and is employed only as a last resort to regain pressure control of the wellbore. The various ram blocks can be changed in the ram preventers, enabling the well team to optimize BOP configuration for the particular hole section or operation in progress.",Noun,Drilling,https://glossary.slb.com/en/terms/r/ram_blowout_preventer
racking back pipe,"To place a stand of drillpipe in the derrick when coming out of the hole on a trip. The rig crew racks back pipe after the stand is unscrewed from the rest of the drillstring. The floor crew then pushes the lower part of the stand away from the rotary table to a position on one side of the vee-door. While the floor crew is pushing the pipe, the derrickman gets ready to pull the top of the stand over into the fingerboards. Once the rig crew has the pipe in the correct location, the driller slacks off on the drawworks, allowing the stand to rest on the drillfloor. This takes weight off of the elevators previously supporting the pipe at the top, so the derrickman can then unlatch the elevators and pull the top of the pipe into the fingerboards for storage. Modern rig designs have automated pipe-handling equipment that moves the pipe. When tripping the pipe out of the hole, racking back pipe may occur every two to five minutes for hours at a time.",Verb,Drilling,https://glossary.slb.com/en/terms/r/racking_back_pipe
round trip,"The complete operation of removing the drillstring from the wellbore and running it back in the hole. This operation is typically undertaken when the bit becomes dull or broken, and no longer drills the rock efficiently. After some preliminary preparations for the trip, the rig crew removes the drillstring 90 ft [27 m] at a time, by unscrewing every third drillpipe or drill collar connection. When the three joints are unscrewed from the rest of the drillstring, they are carefully stored upright in the derrick by the fingerboards at the top and careful placement on wooden planks on the rig floor. After the drillstring has been removed from the wellbore, the dull bit is unscrewed with the use of a bit breaker and quickly examined to determine why the bit dulled or failed. Depending on the failure mechanism, the crew might choose a different type of bit for the next section. If the bearings on the prior bit failed, but the cutting structures are still sharp and intact, the crew may opt for a faster drilling (less durable) cutting structure. Conversely, if the bit teeth are worn out but the bearings are still sealed and functioning, the crew should choose a bit with more durable (and less aggressive) cutting structures. Once the bit is chosen, it is screwed onto the bottom of the drill collars with the help of the bit breaker, the drill collars are run into the hole (RIH), and the drillpipe is run in the hole. Once on bottom, drilling commences again. The duration of this operation depends on the total depth of the well and the skill of the rig crew. A general estimate for a competent crew is that the round trip requires one hour per thousand feet of hole, plus an hour or two for handling collars and bits. At that rate, a round trip in a ten thousand-foot well might take twelve hours. A round trip for a 30,000-ft [9230 m] well might take 32 or more hours, especially if intermediate hole-cleaning operations must be undertaken.",Noun,Drilling,https://glossary.slb.com/en/terms/r/round_trip
rotating control device,A pressure-control device used during drilling for the purpose of making a seal around the drillstring while the drillstring rotates. This device is intended to contain hydrocarbons or other wellbore fluids and prevent their release to the atmosphere.,Noun,Drilling,https://glossary.slb.com/en/terms/r/rotating_control_device
rotary table,"The revolving or spinning section of the drillfloor that provides power to turn the drillstring in a clockwise direction (as viewed from above). The rotary motion and power are transmitted through the kelly bushing and the kelly to the drillstring. When the drillstring is rotating, the drilling crew commonly describes the operation as simply, ""rotating to the right,"" ""turning to the right,"" or, ""rotating on bottom."" Almost all rigs today have a rotary table, either as primary or backup system for rotating the drillstring. Topdrive technology, which allows continuous rotation of the drillstring, has replaced the rotary table in certain operations. A few rigs are being built today with topdrive systems only, and lack the traditional kelly system.",Noun,Drilling,https://glossary.slb.com/en/terms/r/rotary_table
roughneck,"A floor hand, or member of the drilling crew who works under the direction of the driller to make or break connections as drillpipe is tripped in or out of the hole. On most drilling rigs, roughnecks are also responsible for maintaining and repairing much of the equipment found on the drill floor and derrick. The roughneck typically ranks above a roustabout and beneath a derrickman, and reports to the driller.",Noun,Drilling,https://glossary.slb.com/en/terms/r/roughneck
rotary hose,"A large-diameter (3- to 5-in inside diameter), high-pressure flexible line used to connect the standpipe to the swivel. This flexible piping arrangement permits the kelly (and, in turn, the drillstring and bit) to be raised or lowered while drilling fluid is pumped through the drillstring. The simultaneous lowering of the drillstring while pumping fluid is critical to the drilling operation.",Noun,Drilling,https://glossary.slb.com/en/terms/r/rotary_hose
rotary steerable system,"A tool designed to drill directionally with continuous rotation from the surface, eliminating the need to slide a steerable motor. Rotary steerable systems typically are deployed when drilling directional, horizontal, or extended-reach wells. State-of-the-art rotary steerable systems have minimal interaction with the borehole, thereby preserving borehole quality. The most advanced systems exert consistent side force similar to traditional stabilizers that rotate with the drillstring or orient the bit in the desired direction while continuously rotating at the same number of rotations per minute as the drillstring.",Noun,Drilling,https://glossary.slb.com/en/terms/r/rotary_steerable_system
rotary bushing,"Another term for kelly bushing, an adapter that serves to connect the rotary table to the kelly. The kelly bushing has an inside diameter profile that matches that of the kelly, usually square or hexagonal. It is connected to the rotary table by four large steel pins that fit into mating holes in the rotary table. The rotary motion from the rotary table is transmitted to the bushing through the pins, and then to the kelly itself through the square or hexagonal flat surfaces between the kelly and the kelly bushing. The kelly then turns the entire drillstring because it is screwed into the top of the drillstring itself. Depth measurements are commonly referenced to the KB, such as 8327 ft KB, meaning 8327 feet below the kelly bushing.",Noun,Drilling,https://glossary.slb.com/en/terms/r/rotary_bushing
rotary drilling,"A method of making hole that relies on continuous circular motion of the bit to break rock at the bottom of the hole. This method, made popular after the discovery of the East Texas Field by ""Dad"" Joiner in 1930, is much more efficient than the alternative, cable tool drilling. Rotary drilling is a nearly continuous process, because cuttings are removed as drilling fluids circulate through the bit and up the wellbore to the surface. Cable tool operations are discontinuous and cuttings removal is inefficient. This difference in efficiency becomes particularly significant as hole depth increases.",Noun,Drilling,https://glossary.slb.com/en/terms/r/rotary_drilling
rig floor,"The relatively small work area in which the rig crew conducts operations, usually adding or removing drillpipe to or from the drillstring. The rig floor is the most dangerous location on the rig because heavy iron is moved around there. Drillstring connections are made or broken on the drillfloor, and the driller's console for controlling the major components of the rig are located there. Attached to the rig floor is a small metal room, the doghouse, where the rig crew can meet, take breaks and take refuge from the elements during idle times.",Noun,Drilling,https://glossary.slb.com/en/terms/r/rig_floor
reverse circulation,"The intentional pumping of wellbore fluids down the annulus and back up through the drillpipe. This is the opposite of the normal direction of fluid circulation in a wellbore. Since the inside volume of the drillpipe is considerably less than the volume of the annulus outside of the drillpipe, reverse circulation can bring bottomhole fluids to the surface faster than normal circulation for a given flow rate. Two potential hazards of reverse circulation include lifting cuttings and other junk into the drillstring and the rapid flow of reservoir fluids to the surface in a kick situation.",Noun,Drilling,https://glossary.slb.com/en/terms/r/reverse_circulation
reversing out,"Another term for reverse circulation, the intentional pumping of wellbore fluids down the annulus and back up through the drillpipe. This is the opposite of the normal direction of fluid circulation in a wellbore. Since the inside volume of the drillpipe is considerably less than the volume of the annulus outside of the drillpipe, reverse circulation can bring bottomhole fluids to the surface faster than normal circulation for a given flow rate. Two potential hazards of reverse circulation include lifting cuttings and other junk into the drillstring and the rapid flow of reservoir fluids to the surface in a kick situation.",Noun,Drilling,https://glossary.slb.com/en/terms/r/reversing_out
rig,"The machine used to drill a wellbore. In onshore operations, the rig includes virtually everything except living quarters. Major components of the rig include the mud tanks, the mud pumps, the derrick or mast, the drawworks, the rotary table or topdrive, the drillstring, the power generation equipment and auxiliary equipment. Offshore, the rig includes the same components as onshore, but not those of the vessel or drilling platform itself. The rig is sometimes referred to as the drilling package, particularly offshore.",Noun,Drilling,https://glossary.slb.com/en/terms/r/rig
reeled tubing,"Another term for coiled tubing, a long, continuous length of pipe wound on a spool. The pipe is straightened prior to pushing into a wellbore and rewound to coil the pipe back onto the transport and storage spool. Depending on the pipe diameter (1 to 4 1/2 in) and the spool size, coiled tubing can range from 2,000 to 15,000 ft [610 to 4,570 m] or greater length.",Noun,Drilling,https://glossary.slb.com/en/terms/r/reeled_tubing
kelly down,"Referring to the condition that occurs when the kelly is all the way down, so drilling progress cannot continue. A connection must be made, which has the effect of raising the kelly up by the length of the new joint of drillpipe added, so drilling can resume.",Adjective,Drilling,https://glossary.slb.com/en/terms/k/kelly_down
kick,"A flow of formation fluids into the wellbore during drilling operations. The kick is physically caused by the pressure in the wellbore being less than that of the formation fluids, thus causing flow. This condition of lower wellbore pressure than the formation is caused in two ways. First, if the mud weight is too low, then the hydrostatic pressure exerted on the formation by the fluid column may be insufficient to hold the formation fluid in the formation. This can happen if the mud density is suddenly lightened or is not to specification to begin with, or if a drilled formation has a higher pressure than anticipated. This type of kick might be called an underbalanced kick. The second way a kick can occur is if dynamic and transient fluid pressure effects, usually due to motion of the drillstring or casing, effectively lower the pressure in the wellbore below that of the formation. This second kick type could be called an induced kick.",Noun,Drilling,https://glossary.slb.com/en/terms/k/kick
kill,"To stop a well from flowing or having the ability to flow into the wellbore. Kill procedures typically involve circulating reservoir fluids out of the wellbore or pumping higher density mud into the wellbore, or both. In the case of an induced kick, where the mud density is sufficient to kill the well but the reservoir has flowed as a result of pipe movement, the driller must circulate the influx out of the wellbore. In the case of an underbalanced kick, the driller must circulate the influx out and increase the density of the drilling fluid. In the case of a producing well, a kill fluid with sufficient density to overcome production of formation fluid is pumped into the well to stop the flow of reservoir fluids.",Verb,Drilling,https://glossary.slb.com/en/terms/k/kill
kelly,"A long square or hexagonal steel bar with a hole drilled through the middle for a fluid path. The kelly is used to transmit rotary motion from the rotary table or kelly bushing to the drillstring, while allowing the drillstring to be lowered or raised during rotation. The kelly goes through the kelly bushing, which is driven by the rotary table. The kelly bushing has an inside profile matching the kelly's outside profile (either square or hexagonal), but with slightly larger dimensions so that the kelly can freely move up and down inside.",Noun,Drilling,https://glossary.slb.com/en/terms/k/kelly
kelly bushing,"An adapter that serves to connect the rotary table to the kelly. The kelly bushing has an inside diameter profile that matches that of the kelly, usually square or hexagonal. It is connected to the rotary table by four large steel pins that fit into mating holes in the rotary table. The rotary motion from the rotary table is transmitted to the bushing through the pins, and then to the kelly itself through the square or hexagonal flat surfaces between the kelly and the kelly bushing. The kelly then turns the entire drillstring because it is screwed into the top of the drillstring itself. Depth measurements are commonly referenced to the KB, such as 8327 ft KB, meaning 8327 feet below the kelly bushing.",Noun,Drilling,https://glossary.slb.com/en/terms/k/kelly_bushing
KB,"An adapter that serves to connect the rotary table to the kelly. The kelly bushing has an inside diameter profile that matches that of the kelly, usually square or hexagonal. It is connected to the rotary table by four large steel pins that fit into mating holes in the rotary table. The rotary motion from the rotary table is transmitted to the bushing through the pins, and then to the kelly itself through the square or hexagonal flat surfaces between the kelly and the kelly bushing. The kelly then turns the entire drillstring because it is screwed into the top of the drillstring itself. Depth measurements are commonly referenced to the KB, such as 8327 ft KB, meaning 8327 feet below the kelly bushing.",Noun,Drilling,https://glossary.slb.com/en/terms/k/kb
kick off,Intentionally deviate a vertical well.,Verb,Drilling,https://glossary.slb.com/en/terms/k/kick-off
kill line,"A high-pressure pipe leading from an outlet on the BOP stack to the high-pressure rig pumps. During normal well control operations, kill fluid is pumped through the drillstring and annular fluid is taken out of the well through the choke line to the choke, which drops the fluid pressure to atmospheric pressure. If the drillpipe is inaccessible, it may be necessary to pump heavy drilling fluid in the top of the well, wait for the fluid to fall under the force of gravity, and then remove fluid from the annulus. In such an operation, while one high pressure line would suffice, it is more convenient to have two. In addition, this provides a measure of redundancy for the operation. In floating offshore operations, the choke and kill lines exit the subsea BOP stack and run along the outside of the riser to the surface. The volumetric and frictional effects of these long choke and kill lines must be taken into account to properly control the well.",Noun,Drilling,https://glossary.slb.com/en/terms/k/kill_line
keyseat,"A small-diameter channel worn into the side of a larger diameter wellbore. This can be the result of a sharp change in direction of the wellbore (a dogleg), or if a hard formation ledge is left between softer formations that enlarge over time. In either case, the diameter of the channel is typically similar to the diameter of the drillpipe. When larger diameter drilling tools such as tool joints, drill collars, stabilizers, and bits are pulled into the channel, their larger diameters will not pass and the larger diameter tools may become stuck in the keyseat. Preventive measures include keeping any turns in the wellbore gradual and smooth. The remedy to keyseating involves enlarging the worn channel so that the larger diameter tools will fit through it.",Noun,Drilling,https://glossary.slb.com/en/terms/k/keyseat
kelly spinner,"A mechanical device for rotating the kelly. The kelly spinner is typically pneumatic. It is a relatively low torque device, useful only for the initial makeup of threaded tool joints. It is not strong enough for proper torque of the tool joint or for rotating the drillstring itself. The kelly spinner has largely replaced the infamous spinning chains, which were responsible for numerous injuries on the rig floor.",Noun,Drilling,https://glossary.slb.com/en/terms/k/kelly_spinner
kelly hose,"A large-diameter (3- to 5-in inside diameter), high-pressure flexible line used to connect the standpipe to the swivel. This flexible piping arrangement permits the kelly (and, in turn, the drillstring and bit) to be raised or lowered while drilling fluid is pumped through the drillstring. The simultaneous lowering of the drillstring while pumping fluid is critical to the drilling operation.",Noun,Drilling,https://glossary.slb.com/en/terms/k/kelly_hose
liner,"A casing string that does not extend to the top of the wellbore, but instead is anchored or suspended from inside the bottom of the previous casing string. There is no difference between the casing joints themselves. The advantage to the well designer of a liner is a substantial savings in steel, and therefore capital costs. To save casing, however, additional tools and risk are involved. The well designer must trade off the additional tools, complexities and risks against the potential capital savings when deciding whether to design for a liner or a casing string that goes all the way to the top of the well (a ""long string""). The liner can be fitted with special components so that it can be connected to the surface at a later time if need be.",Noun,Drilling,https://glossary.slb.com/en/terms/l/liner
lag gas,"Any gas deliberately introduced into the mud system to help a mudlogger or wellsite geologist track the amount of time or the number of mud pump strokes it takes to circulate mud from the kelly downhole through the drillstring to the bit, and back uphole to the gas trap at the shale shaker. This interval is used to calculate the lag period.",Noun,Drilling,https://glossary.slb.com/en/terms/l/lag_gas
leak off,"The magnitude of pressure exerted on a formation that causes fluid to be forced into the formation. The fluid may be flowing into the pore spaces of the rock or into cracks opened and propagated into the formation by the fluid pressure. This term is normally associated with a test to determine the strength of the rock, commonly called a pressure integrity test (PIT) or a leakoff test (LOT). During the test, a real-time plot of injected fluid versus fluid pressure is plotted. The initial stable portion of this plot for most wellbores is a straight line, within the limits of the measurements. The leakoff is the point of permanent deflection from that straight portion. The well designer must then either adjust plans for the well to this leakoff pressure, or if the design is sufficiently conservative, proceed as planned.",Verb,Drilling,https://glossary.slb.com/en/terms/l/leak_off
leakoff test,"A test to determine the strength or fracture pressure of the open formation, usually conducted immediately after drilling below a new casing shoe. During the test, the well is shut in and fluid is pumped into the wellbore to gradually increase the pressure that the formation experiences. At some pressure, fluid will enter the formation, or leak off, either moving through permeable paths in the rock or by creating a space by fracturing the rock. The results of the leakoff test dictate the maximum pressure or mud weight that may be applied to the well during drilling operations. To maintain a small safety factor to permit safe well control operations, the maximum operating pressure is usually slightly below the leakoff test result.",Noun,Drilling,https://glossary.slb.com/en/terms/l/leakoff_test
leakoff,"The magnitude of pressure exerted on a formation that causes fluid to be forced into the formation. The fluid may be flowing into the pore spaces of the rock or into cracks opened and propagated into the formation by the fluid pressure. This term is normally associated with a test to determine the strength of the rock, commonly called a pressure integrity test (PIT) or a leakoff test (LOT). During the test, a real-time plot of injected fluid versus fluid pressure is plotted. The initial stable portion of this plot for most wellbores is a straight line, within the limits of the measurements. The leakoff is the point of permanent deflection from that straight portion. The well designer must then either adjust plans for the well to this leakoff pressure, or if the design is sufficiently conservative, proceed as planned.",Noun,Drilling,https://glossary.slb.com/en/terms/l/leakoff
LCM,"Solid material intentionally introduced into a mud system to reduce and eventually prevent the flow of drilling fluid into a weak, fractured or vugular formation. This material is generally fibrous or plate-like in nature, as suppliers attempt to design slurries that will efficiently bridge over and seal loss zones. In addition, popular lost circulation materials are low-cost waste products from the food processing or chemical manufacturing industries. Examples of lost circulation material include ground peanut shells, mica, cellophane, walnut shells, calcium carbonate, plant fibers, cottonseed hulls, ground rubber, and polymeric materials.",Noun,Drilling,https://glossary.slb.com/en/terms/l/lcm
